{
  "pages": [
    {
      "url": "https://thehandlebar850.com/contact/",
      "is_candidate": false,
      "has_email": true,
      "text": "Let's Talk\nOur team would love to hear from you.  If you have any feedback on our shows or want to inquire about booking a show, please use the link below.  Before you send us an email…\nAddress\n319 N Tarragona St\nPensacola, FL 32502\nGet Directions\nVenue Hours\nTuesday 4pm - 11pm\nWednesday 4pm - 2am\nThursday 4pm - 2am\nFriday 4pm - 2am\nSaturday 12pm - 2am\nSunday 12pm - 12am\nCan I still smoke inside?\nSorry but smoking is prohibited on the premises.\nIs your venue handicap accessible?\nYes! We are ADA compliant with spacious bathrooms to accommodate anyone with special needs.\nAre there other events allowed at HB aside from live music?\nAbsolutely! The Handlebar is always down to be the place for all sorts of unique ideas. Whether you want to host a market, a painting workshop, a chili cookoff, or anything else that comes to mind please feel free to reach out. We would love to be a resource for the community.\nI’m in a band, how do I play at the Handlebar?\nWe look forward to booking as many bands as possible at The Handlebar. For booking inquiries, please contact\nrobert@thehandlebar850.com\nand be sure to include any of the following:\nLinks to music and social media\nProposed date ranges and lineup\nA brief bio including show history\nA video of your favorite live performance\nVenue Hours\nTuesday 4pm - 11pm\nWednesday 4pm - 2am\nThursday 4pm - 2am\nFriday 4pm - 2am\nSaturday 12pm - 2am\nSunday 12pm - 12am\n319 N Tarragona St\nPensacola, FL 32502\nAddress\n319 N Tarragona St\nPensacola, FL 32502\nGet Directions\nPowered By\nSpread\nthe word\nPENSACOLA’S LEGENDARY MUSIC VENUE IS BACK AND BOOKING FOR\nSUMMER\n2025\nVisit our Facebook\nVisit our Instagram\nEvents\nNotable Acts\nBooking\nBar Menu\nAbout\nBlog\nContact\nWebsite & Ticketing Powered by TicketSilver",
      "emails": [
        "booking@thehandlebar850.com",
        "michael@silver-industries.com",
        "robert@thehandlebar850.com"
      ]
    },
    {
      "url": "https://thehandlebar850.com/events/",
      "is_candidate": false,
      "has_email": true,
      "text": "01/02/25 - Gnarled, Red Beard Wall, Blight, Innerwounds, Decaying Eucharist\n2025-01-02 7:00 PM\nGet Tickets\n01/03/25 - Heavy Weather, About to Sweat, Funky Lampshades\n2025-01-03 7:00 PM\nGet Tickets\n01/05/25 - Daikaiju, Rufus McBlack and Brickbats\n2025-01-05 7:00 PM\nGet Tickets\n01/09/25 - Six Feet Under\n2025-01-09 7:00 PM\nGet Tickets\n01/11/25 - glsnr, Scream Out Loud, With Fire Came Disparity, Palafoxx,  Snow Halo, Grave Chorus\n2025-01-11 15:30\nGet Tickets\n01/13/25 - Lilith's Demise, Oinkliteration, Innerwounds, Hemolocria\n2025-01-13 7:00 PM\nGet Tickets\n01/16/25 - Sheer Terror, Burning Strong, Serrated FL\n2025-01-16 7:00 PM\nGet Tickets\n01/17/25 - BROADWAY RAVE\n2025-01-17 8:00 PM\nGet Tickets\n01/18/25 - Counterfeit: A Tribute to Limp Bizkit , Transient, Exformation\n2025-01-18 7:00 PM\nGet Tickets\n01/19/25 Ellis Bullard, The Victrolas, Allie Bryan\n2025-01-19 3:00 PM\nGet Tickets\n01/20/25 - Bonginator, Frog Mallet, Trash Panda\n2025-01-20 7:00 PM\nGet Tickets\n01/23/25 - The Band Feel, The Retrograde\n2025-01-23 6:00 PM\nGet Tickets\n01/24/25 - Flying Raccoon Suit, Runaway Ricochet, Red And The Revelers\n2025-01-24 7:00 PM\nGet Tickets\n01/25/25 - Taylor Hollingsworth, Mourning Glories\n2025-01-25 7:00 PM\nGet Tickets\n01/26/25 - Pensacola Songwriter Rounds Series , Mick Grocholl, Runi Salem,  Nate Clay, Katie Dineen, Michael Magno\n2025-01-26 3:00 PM\nGet Tickets\n01/27/26 - Comedian GABRIEL RUTLEDGE - Don't Read the Comments Tour\n\"Gabriel Rutledge is a quick thinking, fast talking, hard working badass.\" - Louisville Weekly A past winner of both the Seattle International Comedy Competition and The Laughing Skull  Comedy Festival in Atlanta, Gabriel has made numerous television appearances including  Comedy Central's Live at Gotham, Nickelodeon's Nickmom Night Out, Laughs on FOX, and  Inside Joke streaming on Amazon Prime Video. His […]\n2026-01-27 8:00 PM\nGet Tickets\n01/29/25 - Improvable Cause \"Cheese for the Table\"\n2025-01-29 7:00 PM\nGet Tickets\n01/31/25 - Dead Register, Insomniac\n2025-01-31 7:00 PM\nGet Tickets\n02/05/25 - Two Piece, Chain Gang, Pure Bliss, Statement of Pride\n2025-02-05 7:00 PM\nGet Tickets\n02/06/25 - Maggie Miles, Recess Party, Sofia Camille\n2025-02-06 7:00 PM\nGet Tickets\n02/07/25 - Jumping the Gun, No Complications, Lights With Fire\n2025-02-07 7:00 PM\nGet Tickets\n02/08/25 - Brainburn (EP Release), Delta Hate, Paid in Blood, Eyezin, No  Surrender\n2025-02-08 7:00 PM\nGet Tickets\n02/09/25 - Herakleion, Void, Infernem, Hemlock\n2025-02-09 6:00 PM\nGet Tickets\n02/13/25 - ZULU, LIE, Knife Wound, No Surrender\n2025-02-13 8:00 PM\nGet Tickets\n02/14/25 - Vision Video, Grave Chorus\n2025-02-14 7:00 PM\nGet Tickets\n02/15/25 - Cane Hill, Mugshot, Fox Lake, Weeping Wound\n2025-02-15 7:00 PM\nGet Tickets\n02/16/25 - Be Mine Burlesque\n2025-02-16 8:00 PM\nGet Tickets\n02/18/25 - American Aquarium\n2025-02-18 7:00 PM\nGet Tickets\n02/21/25 - The Good Lookings, Color the Void, Safety Training, Funky  Lampshades\n2025-02-21 7:00 PM\nGet Tickets\n02/22/25 - Palomino Blond, High, Lazy Chair\n2025-02-22 7:00 PM\nGet Tickets\n02/23/25 - Agent Orange & Kinder, Gentler\n2025-02-23 6:00 PM\nGet Tickets\n02/26/25 - Improvable Cause: \"Cheese for the Table\"\n2025-02-26 7:00 PM\nGet Tickets\n02/27/25 - Pensacola Songwriter Rounds Series\n2025-02-27 6:00 PM\nGet Tickets\n02/28/25 - Mardi Grass & Brass, The New Cahoots, 5 Mile Brass\n2025-02-28 8:00 PM\nGet Tickets\n03/01/25 - Swallow The Sun, Harakiri For The Sky, Ghost Bath, Snakes of Russia, Blight\n2025-03-01 6:00 PM\nGet Tickets\n03/03/25 - Comedian STEVE HOFSTETTER with Special Guests\nOne of YouTube's most popular comics with over 225 million views and half a billion more on Facebook, Steve Hofstetter is also the host of Finding Babe Ruth on FS1. Hofstetter was the host and executive producer of Laughs (FOX) and he has been on CBS’ The Late Late Show, E! True Hollywood Story, Comics […]\n2025-03-03 8:00 PM\nGet Tickets\n03/04/25 - Smoking Popes, Camp Trash, Rodeo Boys\n2025-03-04 7:00 PM\nGet Tickets\n03/07/25 - GIMME GIMME DISCO\n2025-03-07 8:00 PM\nGet Tickets\n03/08/25 - Salvo (Members of Pain) , Nik Flagstar And His Dirty Mangy Dogs\n2025-03-08 7:00 PM\nGet Tickets\n03/09/25 - partygirl, Mourning Glories, Basically Nancy, Rat Palace\n2025-03-09 6:00 PM\nGet Tickets\n03/11/25 - Reconciler, Pauper's Grave, Lunch Break\n2025-03-11 7:00 PM\nGet Tickets\n03/14/25 - Pensacola Hardcore Showcase , Burning Strong, Statement of  Pride, Spiral, No Surrender & More!\n2025-03-14 7:00 PM\nGet Tickets\n03/15/25 - Ben Loftin & The Family , John Hart Project\n2025-03-15 7:00 PM\nGet Tickets\n03/16/25 - Milly, Garage Sale, Kairo, Palmmeadow, Garden Dweller\n2025-03-16 6:00 PM\nGet Tickets\n03/20/25 - Rugh, Basilantros, Brickbats, Other\n2025-03-20 7:00 PM\nGet Tickets\n03/21/25 - Glorious Flaws , Outlook Bleak, Wild Charge\n2025-03-21 7:00 PM\nGet Tickets\n03/22/25 - STRIVE Fundraiser Benefit Show\n2025-03-22 8:00 PM\nGet Tickets\n03/23/25 - Capstan - The Cult Tour, Colorblind, Not Enough Space, Afterdusk\n2025-03-23 7:00 PM\nGet Tickets\n03/24/25 - Haunt, Hitten\n2025-03-24 7:00 PM\nGet Tickets\n03/26/25 - Improvable Cause \"Cheese for the Table\"\n2025-03-26 7:00 PM\nGet Tickets\n03/27/25 - Cavae Mundi, Morning Trips, Asocial Media, Hishiwi\n2025-03-27 7:00 PM\nGet Tickets\n03/28/25 - Urban Heat, Ynicorns, Tirra Lirra\n2025-03-28 7:00 PM\nGet Tickets\n03/29/25 - Ritual 6: Goth/Industrial Night\n2025-03-29 8:00 PM\nGet Tickets\n03/30/25 - Pensacola Songwriter Rounds Series,\n2025-03-30 3:00 PM\nGet Tickets\n04/03/25 - Cloakroom, Blight, Snow Halo\n2025-04-03 7:00 PM\nGet Tickets\n04/04/25 - '68, Silly Goose, Islander, Sick Room\n2025-04-04 7:00 PM\nGet Tickets\n04/05/25 - XOTIX, BRAINRACK, Cam The Sella, Parkit, T1LT3D\n2025-04-05 8:00 PM\nGet Tickets\n04/06/25 - Them Dirty Roses, The Victrolas\n2025-04-06 6:00 PM\nGet Tickets\n04/07/25 - Age of Apocalypse, Despize, Cross of Disbelief, Paid in Blood, Serrated\n2025-04-07 7:00 PM\nGet Tickets\n04/10/25 - Dionysus, Funk Heads, Lightyear Sisters\n2025-04-10 7:00 PM\nGet Tickets\n04/11/25 - Fried Green Friday, Panhandle Pirates, CremRo Smith, Dusty  DeLuna, Sco Mazzi, (and more)\n2025-04-11 7:00 PM\nGet Tickets\n04/12/25 - Jaimes Miller Benefit Show , n/a\n2025-04-12 7:00 PM\nGet Tickets\n04/13/25 - Atoll, Demon King, Cesspool Corruption, Rat King, Accursed  Creator\n2025-04-13 7:00 PM\nGet Tickets\n04/16/25 - Improvable Cause, Cheese for the Table\n2025-04-16 7:00 PM\nGet Tickets\n04/17/25 - Gulf Coast Kid's House Benefit, n/a\n2025-04-17 7:00 PM\nGet Tickets\n04/18/25 - Widow Anchor, Tremors, Knives, With Fire Came Disparity\n2025-04-18 7:00 PM\nGet Tickets\n04/19/25 - Lunar Vacation, Hannah Cole, Snake and the Rabbit\n2025-04-19 7:00 PM\nGet Tickets\n04/20/25 - Wormrot, No/Mas, Bandit, Infernem\n2025-04-20 7:00 PM\nGet Tickets\n04/22/25 - Clementine, Lights With Fire, Kyker, Other\n2025-04-22 7:00 PM\nGet Tickets\n04/25/25 - Emo Night Feat. DJDT\n2025-04-25 8:00 PM\nGet Tickets\n04/26/25 - Hopout, GLSNR, NVSN, Oversight\n2025-02-17 7:00 PM\nGet Tickets\n04/27/25 - Dear Cincinnati, Almost,  No Complications\n2025-04-27 2:00 PM\nGet Tickets\n04/27/25 - The Sapphic Stage Presents: Cowboys vs Aliens\n2025-04-27 8:00 PM\nGet Tickets\n05/02/25 - High Life Supernova, Goldmine, Tuffalo and The Treewalkers, The  Big Reveal\n2025-05-02 7:00 PM\nGet Tickets\n05/03/25 - Bearly Dead\n2025-05-03 7:00 PM\nGet Tickets\n05/04/25 - The Toasters, Matamoska\n2025-05-04 7:00 PM\nGet Tickets\n05/08/25 - Come to Ruin, User Assumes Risk\n2025-05-08 7:00 PM\nGet Tickets\n05/09/25 - Boots n Beats | A Country EDM Concert\n2025-05-09 8:00 PM\nGet Tickets\n05/10/25 - Night on the Tracks, Palmmeadow, Mourning Glories, Grave  Chorus, Lasento\n2025-05-10 7:00 PM\nGet Tickets\n05/11/25 - He is Legend , Cancer Bats, Strawberry Girls, The Requiem\n2025-05-11 6:00 PM\nGet Tickets\n05/14/25 - Save Ferris, Keep Flying\n2025-05-14 7:00 PM\nGet Tickets\n05/15/25 - Alesana , Scream Out Loud, Brave New World, Rise Up Lights\n2025-05-15 7:00 PM\nGet Tickets\n05/16/25 - Ritual 6: Goth/Industrial Night\n2025-05-16 8:00 PM\nGet Tickets\n05/17/25 - Sanguisugabogg, 200 Stab Wounds, Gridiron, Mutilatred\nONSALE FEB 14 @ 12PM\n2025-05-17 6:00 PM\nGet Tickets\n05/18/25 - Pensacola Songwriter Rounds Series, Pat Muesel, Hale Whisler,  Kat Deal, Katie Dineen\n2025-05-18 3:00 PM\nGet Tickets\n05/19/25 - Peeling Flesh, Two-Piece\n2025-05-19 6:00 PM\nGet Tickets\n05/20/25 - ATTACK ATTACK!, Convictions, Downswing, and Uncured\n2025-05-20 6:00 PM\nGet Tickets\n05/22/25 - Beat Up, Shidded, Palmmeadow, Lazy Chair\n2025-05-22 7:00 PM\nGet Tickets\n05/23/25 - Woorms, Future Hate\n2025-05-23 7:00 PM\nGet Tickets\n05/24/25 - Lucero, Heavy Kid\n2025-05-24 7:00 PM\nGet Tickets\n05/25/25 - Ctrl Alt Drag\n2025-05-25 8:00 PM\nGet Tickets\n05/28/25 - Improvable Cause Presents \"Cheese for the Table\"\ndo_shortcode( '' ); test\n2025-05-28 7:00 PM\nGet Tickets\n05/29/25 - Umphrey's McGee Afterparty, Runaway Gin (Phish Tribute)\n2025-05-29 9:00 PM\nGet Tickets\n05/30/25 - Wim Tapley & the Cannons, Katie Dineen, Starlin, Andrew Vinson\n2025-05-30 7:00 PM\nGet Tickets\n05/31/25 - WORK IT! : 90s/2000s R&B and Hip Hop Night featuring 12Eleven\n2025-05-31 19:30\nGet Tickets\n06/01/25 - Power Bomb, Noise Next Door, Marigold's Apprentice, Mourning  Glories\n2025-06-01 7:00 PM\nGet Tickets\n06/04/25 - Haywire, No Guard, Statement of Pride, Serrated FL, Command Voice\n2025-06-04 6:00 PM\nGet Tickets\n06/06/25 - [glsnr], Baby in the 90s, Peace Pursuers, Aumua, Other\n2025-06-06 7:00 PM\nGet Tickets\n06/07/25 - Broadway Rave\n2025-06-07 7:00 PM\nGet Tickets\n06/08/25 - In Her Own Words, Embl3m, Glimmers, Oversight,  Safety Training\n2025-06-08 7:00 PM\nGet Tickets\n06/09/25 - Ghost Chant, Fly Over States, Scream Out Loud, Rise Up Lights\n2025-06-09 6:00 PM\nGet Tickets\n06/10/25 - Recovery Benefit Show, Marigold's Apprentice, Wild Charge, Paid to Pretend, Glazed Eyes, Mourning Glories\n2025-06-10 6:00 PM\nGet Tickets\n06/12/25 - Bodybox, Decoy, Fogcrawler, Morraagora, Command Voice\n2025-06-12 7:00 PM\nGet Tickets\n06/13/25 - Casket Robbery, Autumn Lies Buried\n2025-06-13 7:00 PM\nGet Tickets\n06/14/25 - House of Androgyny Drag Show\n2025-06-14 8:00 PM\nGet Tickets\n06/16/25 - TX2, Dark Divine\n2025-06-16 7:00 PM\nGet Tickets\n06/17/25 - Ginger Root\n2025-06-17 7:00 PM\nGet Tickets\n06/18/25 - MIKE V and the RATS, Nik Flagstar,  Kinder Gentler\n2025-06-18 6:00 PM\nGet Tickets\n06/20/25 - Saint Social, Marigold's Apprentice, Neon Tomboy, Willow and the Misdemeanors\n2025-06-20 7:00 PM\nGet Tickets\n06/21/25 - WE THE KINGS, Hopout, Color the Void\n2025-06-21 8:00 PM\nGet Tickets\n06/22/25 - ORTHODOX, Mugshot, Omerta, from joy\n2025-06-22 7:00 PM\nGet Tickets\n06/23/25 - Authority Zero/Voodoo Glow Skulls, Pinata Protest, Red and the Revelers\n2025-06-23 6:00 PM\nGet Tickets\n06/24/25 - Lie, Cable, Paid in Blood, Command Voice\n2025-06-24 7:00 PM\nGet Tickets\n06/25/25 - Improvable Cause Presents \"Cheese for the Table\"\n2025-06-25 7:00 PM\nGet Tickets\n06/26/25 - Pensacola Songwriter Rounds, Johnny Hayes, Molly Thomas, Noah Desimone, Katie Dineen\n2025-06-26 6:00 PM\nGet Tickets\n06/27/2025 - Mayhem Monster Party, Lady Gaga Drag Preshow by Terrah Card\n2025-06-27 7:00 PM\nGet Tickets\n06/27/25 - CTRL ALT Drag- Mayhem Monster Party\n2025-06-27 7:00 PM\nGet Tickets\n06/27/25 - GAGA NIGHTS - Lady Gaga Dance Party\n2025-06-27 9:00 PM\nGet Tickets\n06/28/25 - Emo Rave , Presented by Kulture Kreated x Bassick\n2025-06-28 8:00 PM\nGet Tickets\n06/29/25 - Infernem , White Phosphorous, Hangnail Ripoff, Face of Relief\n2025-06-29 6:00 PM\nGet Tickets\n06/30/25 - Suffocation, Accursed Creator, Modown, Hemlock\n2025-06-30 6:00 PM\nGet Tickets\n07/05/25 - BLOODRAVE\n2025-07-05 8:00 PM\nGet Tickets\n07/06/25 - Tuffalo and The Treewalkers, Tremors, Aleks Arcari\n2025-07-06 6:00 PM\nGet Tickets\n07/10/25 - Snacks, Tirra Lirra, Other, Garden Dweller\n2025-07-10 7:00 PM\nGet Tickets\n07/11/25 - Seth David, Chozen\n2025-07-11 8:00 PM\nGet Tickets\n07/12/25 - FIVE EIGHT- \"Weirdo-The Story of Five Eight\" DOCUMENTARY SCREENING AND FULL LIVE PERFORMANCE\n2025-07-12 7:00 PM\nGet Tickets\n07/13/25 - Ouija Macc, Another Summer In Hell, Sinizter\n2025-07-13 6:00 PM\nGet Tickets\n07/14/25 - Gunshine, Power Bomb\n2025-07-14 6:00 PM\nGet Tickets\n07/17/25 - CANNIBAL KIDS, PRETORIA, Morning Trips, Marigold's Apprentice\n2025-07-17 7:00 PM\nGet Tickets\n07/18/25 - No Truth, Exit Life, Trash World, Strikeforce, Serrated FL, Hangnail Ripoff\n2025-07-18 18:30\nGet Tickets\n07/19/25 - Tanktok, Spence B, DJ Dad, Birdz, Brody\n2025-07-19 7:00 PM\nGet Tickets\n07/20/25 - Caving In, Dead Etiquette, Rise Up Lights, Widow Anchor, Ghostlings\n2025-07-20 5:00 PM\nGet Tickets\n07/21/25 - Profanatica , Unidad Trauma, Knoll\n2025-07-21 6:00 PM\nGet Tickets\n07/23/25 - Kaleidoscope Crux, Safety Training, Aliens Do Exist\n2025-07-23 6:00 PM\nGet Tickets\n07/24/25 - Pensacola Songwriter Rounds Series, Katie Dineen, Tori Lucia, Gage Cowart, Andrew Vinson\n2025-07-24 6:00 PM\nGet Tickets\n07/25/25 - GIMME GIMME DISCO\n2025-07-25 8:00 PM\nGet Tickets\n07/26/25 - Rufus McBlack , [glsnr], Color The Void, Snow Halo\n2025-07-26 7:00 PM\nGet Tickets\n07/27/25 - Bear Ghost, Spaceman Bob\n2025-07-27 7:00 PM\nGet Tickets\n07/29/25 - Ballyhoo!, Cydeways, Beachfly, Tuffalo & The Treewalkers\n2025-07-29 6:00 PM\nGet Tickets\n07/30/25 - Improvable Cause Presents \"Cheese for the Table\"\n2025-07-30 7:00 PM\nGet Tickets\n07/31/25 - Tyler Livingston and Tyler Mac\n2025-07-31 7:00 PM\nGet Tickets\n08/01/25 - BRAT, The Taints, Spiral Broke, Florida Boys\n2025-08-01 7:00 PM\nGet Tickets\n08/02/25 - 80s Video Night w/ DJ Poseidon\n2025-08-02 8:00 PM\nGet Tickets\n08/03/25 - CTRL ALT DRAG\n2025-08-03 7:00 PM\nGet Tickets\n08/05/25 - 20 Watt Tombstone, Lesion, Sungraz\n2025-08-05 7:00 PM\nGet Tickets\n08/07/25 - HARBOUR, Abby Holiday, Saint Social\n2025-08-07 7:00 PM\nGet Tickets\n08/08/25 - The Bottoms, Heavy Kid, Starlin\n2025-08-08 7:00 PM\nGet Tickets\n08/09/25 - The Supervillains, Nothing Short of Pure, Panhandle Pirates\nBorn from the swamps of St. Cloud, Florida in 1997, The  Supervillains have spent nearly three decades fusing ska, punk, and reggae  into their own brand of rowdy, high-energy rock. What started as a group of  misfit musicians with a rebellious streak quickly evolved into a full-force  touring machine, bringing their infectious sound to countless stages across  North America and […]\n2025-08-09 9:00 PM\nGet Tickets\n08/10/25 - Grizz, Vick Vapors, User Assumes Risk\n2025-08-10 7:00 PM\nGet Tickets\n08/11/25 - YOT CLUB, Cathedral Bells, Palmmeadow\n2025-08-11 7:00 PM\nGet Tickets\n08/14/25 - Attack Dog,Tirra Lirra, Lights With Fire\n2025-08-14 8:00 PM\nGet Tickets\n08/15/25 - Flow Tribe, The Nova\n2025-08-15 7:00 PM\nGet Tickets\n08/16/25 - House of Androgyny\n2025-08-16 18:30\nGet Tickets\n08/18/25 - Dayglo Abortions, Future Hate, Jersey Shore Shark Attack\n2025-08-18 7:00 PM\nGet Tickets\n08/19/25 - Boundaries, Stick To Your Guns, Gates To Hell, Psycho-Frame\n2025-08-19 6:00 PM\nGet Tickets\n08/21/25 - Slow Degrade, Day Aches, Tuffalo & The Treewalkers, Lucid\n2025-08-21 6:00 PM\nGet Tickets\n08/22/25 - Ritual 6: Goth/Industrial Night\n2025-08-22 8:00 PM\nGet Tickets\n08/23/25 - FELMAX, Big n Slim, HYDYNE, Smoothlettuce\n2025-08-23 8:00 PM\nGet Tickets\n08/24/25 - Panhandle Slam Jam\n2025-08-24 4:00 PM\nGet Tickets\n08/26/25 - Keep, Leaving Time, Kairo, Dalton Wright\n2025-08-26 7:00 PM\nGet Tickets\n08/27/25 - Improvable Cause Presents \"Cheese for the Table\"\n2025-08-27 7:00 PM\nGet Tickets\n08/28/25 - Pensacola Songwriter Round Series\n2025-08-28 6:00 PM\nGet Tickets\n08/29/25 - Cutthroat & Friends\n2025-08-29 8:00 PM\nGet Tickets\n08/30/25 - Downtown Meltdown , Ben Loftin & The Family, Katie Dineen, and more!\n2025-08-30 1:00 PM\nGet Tickets\n08/31/25 - Crowbar & Eyehategod, Slowhole, Exformation\n2025-08-31 6:00 PM\nGet Tickets\n09/04/25 - Pensacola Comedy Club , Featuring Ryan Pfeiffer, Lena Ibrahim, and Arun Krishnan\n2025-09-04 8:00 PM\nGet Tickets\n09/06/25 - Mr. Gnome, [glsnr], Palmmeadow\n2025-09-06 7:00 PM\nGet Tickets\n09/12/25 - Big Time Maca , Sam Skolnik, Olivia Searcy, Ray Lau, Aaron Monte\n2025-09-12 7:00 PM\nGet Tickets\n09/13/25 - Grits & Greens, Nerf The World, Funky Lampshades\n2025-09-13 7:00 PM\nGet Tickets\n09/14/25 - Kimmi Bitter, Snake and The Rabbit, Katie Dineen\n2025-09-14 3:00 PM\nGet Tickets\n09/17/25 - Dylan Cotrone\n2025-09-17 6:00 PM\nGet Tickets\n09/20/25 - BROADWAY RAVE\nCalling all Musical Theatre nerds, drama geeks, actors, actresses, theatre lovers, and more! Welcome to Broadway Rave, a Broadway Dance Party celebrating the best in show-tunes and musical theatre! Come sing along to all of your favorite broadway hits while dressed up as your favorite character. We’ll have surprise guests from some of your favorite Broadway stars! Live out […]\n2025-09-20 8:00 PM\nGet Tickets\n09/21/25 - Insomniac, Cursed Body\n2025-09-28 6:00 PM\nGet Tickets\n09/22/25 - Filth, Narcotic Wasteland, Innerwounds, Spidershed\n2025-09-22 7:00 PM\nGet Tickets\n09/24/25 - THE HAILS, Edgehill\nFollowing a string of encounters too strange to be coincidence, Robbie Kingsley, Franco Solari, Dylan McCue, Andre Escobar and Zach Levy came together to form The Hails. Despite first playing in an insular Miami high school music scene, the band officially formed at the University of Florida in Gainesville, turning the tattered carpeting and beer bottle lined shelves of their […]\n2025-09-24 8:00 PM\nGet Tickets\n09/26/25 - Red and the Revelers, Rufus McBlack\n2025-09-26 6:00 PM\nGet Tickets\n09/28/25 - Zac Amino, Zach Holmes\n2025-09-28 7:00 PM\nGet Tickets\n09/30/25 - I Set My Friends On Fire, Enthronement, Hopout, With Fire Came Disparity\n2025-09-30 6:00 PM\nGet Tickets\n10/01/24 - Gulf Coast Drag Race\n2024-10-01 8:00 PM\nGet Tickets\n10/02/25 - Petite League\n2025-10-02 7:00 PM\nGet Tickets\n10/03/25 - Afterdusk, Nick Nasty, Dead Etiquette, Caving In\n2025-10-03 7:00 PM\nGet Tickets\n10/04/25 - The Constellations, Heavy Kid, PALMMEADOW\n2025-10-04 7:00 PM\nGet Tickets\n10/05/25 - Comedian SHELLY BELLY\n2025-10-05 7:00 PM\nGet Tickets\n10/08/24 - Gulf Coast Drag Race\n2024-10-08 8:00 PM\nGet Tickets\n10/08/25 - Panzerfaus, Groza, Exformation, Infernem, Accursed Creator\n2025-10-08 7:00 PM\nGet Tickets\n10/09/25 - Glixen, Easterlin, Kairo, Slow Degrade\n2025-10-09 7:00 PM\nGet Tickets\n10/10/24 - Dee Dee Kohl Benefit Show, Ben Loftin, Mike Garcia & John Hart, Kairo, Glazed Eyes\n2024-10-10 7:00 PM\nGet Tickets\n10/10/25 - WORK IT: 90s/2000s R&B and Hip Hop Night\n2025-10-10 8:00 PM\nGet Tickets\n10/11/25 - The Callous Daoboys, UnityTX, Your Spirit Dies, Crush\n2025-10-11 7:00 PM\nGet Tickets\n10/12/24 - Vosh, Shehehe, STGMA\n2024-10-12 7:00 PM\nGet Tickets\n10/13/24 - Cookies and Cake, Goodwin Rainer, Julie Nolen, Wiley Gaby\n2024-10-13 6:00 PM\nGet Tickets\n10/13/25 - Archers, Nerv, Of Virtue, Dead Eyes\n2025-10-13 6:00 PM\nGet Tickets\n10/15/24 - Gulf Coast Drag Race\n2024-10-15 8:00 PM\nGet Tickets\n10/15/25 - Thou, Slugger\n2025-10-15 6:00 PM\nGet Tickets\n10/17/24 - Eric Lindell, Katie Dineen\n2024-10-17 7:00 PM\nGet Tickets\n10/17/25 - Bassick Events x SweetTooth DMZ Tour\n2025-10-17 8:00 PM\nGet Tickets\n10/18/24 - Terrifying Tribute Show, Cockfight, Cavae Mundi, Roman Gabriel Todd, Future Hate, Glazed Eyes, Acorns, The Spillers\n2024-10-18 6:00 PM\nGet Tickets\n10/18/25 - Taylor Hunnicutt, Snake and the Rabbit, The Victrolas\n2025-10-18 7:00 PM\nGet Tickets\n10/19/24 - Evalution x Dennett, Fifthdensity, Tripsitter, Wermzer\n2024-10-19 8:00 PM\nGet Tickets\n10/19/25 - Nik Flagstar And His Dirty Mangy Dogs, Proper Punktuation, Matthew W Charles\n2025-10-19 6:00 PM\nGet Tickets\n10/20/24 - Pensacola Songwriter Rounds Show Series , John Hart, Justin Colvard, Lundy, Katie Dineen\n2024-10-20 3:00 PM\nGet Tickets\n10/20/25 - Mexican Slum Rats, Paid to Pretend, Snow Halo\n2025-10-20 7:00 PM\nGet Tickets\n10/21/24 - MANNEQUIN PUSSY, Margaritas Podridas\n2024-10-21 7:00 PM\nGet Tickets\n10/22/24 - Gulf Coast Drag Race\n2024-10-22 8:00 PM\nGet Tickets\n10/23/24 - Improvable Cause, Cheese for the Table\n2024-10-23 7:00 PM\nGet Tickets\n10/24/24 - Christworm, Decaying Eucharist, Hemlock\n2024-10-24 5:00 PM\nGet Tickets\n10/24/24 - Icons of Horror, Hanna Biotic, Joan of Dark, Goblin Babe, Bones, Xena Morphine, Braxton Hicks, Miss Fortune, Wanda Doomy\n2024-10-24 8:00 PM\nGet Tickets\n10/25/24 - Brave New World, Oversight, Safety Training\n2024-10-25 7:00 PM\nGet Tickets\n10/26/24 - [glsnr], Blind Tiger, Hopout, Cavae Mundi, Spiral\n2024-10-26 7:00 PM\nGet Tickets\n10/27/24 - Pentagram String Band, Marigold's Apprentice, Tuffalo and the Treewalkers\n2024-10-27 6:00 PM\nGet Tickets\n10/28/24 - Boss’ Daughter, Hans Gruber and the Die Hards,  Outlook Bleak, White Phosphorus\n2024-10-28 7:00 PM\nGet Tickets\n10/29/24 - PIG, Unitcode Machine\n2024-10-29 7:00 PM\nGet Tickets\n10/30/24 - Exhorder, Forsaken Profits, Dead Devils\n2024-10-30 6:00 PM\nGet Tickets\n10/30/25 - Silverada\n2025-10-30 7:00 PM\nGet Tickets\n10/31/24 - Ritual 6: Goth/Industrial Dance Party\n2024-10-31 8:00 PM\nGet Tickets\n11/01/24 - Strive Anniversary Benefit Show\n2024-11-01 7:00 PM\nGet Tickets\n11/01/25 - Jins\n2025-11-01 6:00 PM\nGet Tickets\n11/02/24 - Gimme Gimme Disco\n2024-11-02 8:00 PM\nGet Tickets\n11/02/25 - The Dangerous Summer, Bad Luck\n2025-11-02 6:00 PM\nGet Tickets\n11/03/24 - Matt \"Haus\" Memorial & Benefit , FateJacket, Bangarang Peter, Paupers Grave, Tremõrs, Shelly Clutts & Never Ending\n2024-11-03 3:00 PM\nGet Tickets\n11/04/25 - French Cassettes\n2025-11-04 7:00 PM\nGet Tickets\n11/05/24 - Gulf Coast Drag Race\n2024-11-05 8:00 PM\nGet Tickets\n11/06/25 - Galactic Empire\n2025-11-06 7:00 PM\nGet Tickets\n11/07/24 - Anthony Raneri - The Everyday Royalty Tour\n2024-11-07 8:00 PM\nGet Tickets\n11/09/24 - Hizashicon Aftershow, Mac Ro, Azazus, Pagu\n2024-11-09 7:00 PM\nGet Tickets\n11/09/25 - Nixil, Saidan\n2025-11-09 6:00 PM\nGet Tickets\n11/10/24 - Show Me the Body, MSPAINT, Mid Evil Times\n2024-11-10 7:00 PM\nGet Tickets\n11/10/25 - Narrow Head, Judiciary\n2025-11-10 7:00 PM\nGet Tickets\n11/12/24 - Rootbeer Richie & the Reveille, Bankhead Boys, Brickbats\n2024-11-12 7:00 PM\nGet Tickets\n11/14/24 - Fury in Few , Drook, Palmmeadow, Dead Etiquette, Dead Allies\n2024-11-14 7:00 PM\nGet Tickets\n11/14/25 - INOHA, Slow Joy, Worry Club\n2025-11-14 8:00 PM\nGet Tickets\n11/15/24 - Jordan Chase , Melodious Allen & The Funk Heads, Ben Loftin\n2024-11-15 7:00 PM\nGet Tickets\n11/16/24 - SPIRAL, InnerWounds, Dead Allies, Aliens Exist, Lu Kang\n2024-11-16 7:00 PM\nGet Tickets\n11/19/24 - Left Lane Cruiser, 20 Watt Tombstone, Dead Devils\n2024-11-19 7:00 PM\nGet Tickets\n11/20/24 - Snooper, Real People, Caboboing, Mid Evil Times\n2024-11-20 6:00 PM\nGet Tickets\n11/22/24 - Cytotoxin, Cognitive, Inoculation, Necroticgorebeast, Rotted Remains, and Hemlock\n2024-11-22 6:00 PM\nGet Tickets\n11/24/24 - Pensacola Songwriter Rounds Show Series , Myke V., Austin Thompson, Jacob Kirkland, Katie Dineen\n2024-11-24 3:00 PM\nGet Tickets\n11/29/24 - About To Sweat, Lee Pilcher And The River Rats, Lights With Fire, Lightyear Sisters\n2024-11-29 7:00 PM\nGet Tickets\n11/30/24 - Bottomless Brunch Hosted by Terrah Card\n2024-11-30 11:00\nGet Tickets\n11/30/24 - Red and the Revelers, Grits & Greens, Bangarang Peter\n2024-11-30 7:00 PM\nGet Tickets\n12/05/24 - HIRS Collective, Deceased\n2024-12-05 7:00 PM\nGet Tickets\n12/06/24 - Gnarled, Brethren Hogg, Slugger\n2024-12-06 8:00 PM\nGet Tickets\n12/07/24 - Party Iconic Presents CHARLI PARTI\n2024-12-07 8:00 PM\nGet Tickets\n12/09/24 - Edhochuli, Acorns, Lobachevsky, Rat Daughter\n2024-12-09 7:00 PM\nGet Tickets\n12/10/24 - Emily Nenni, Jarred Mcconnell and the High Aces\n2024-12-10 7:00 PM\nGet Tickets\n12/11/24 - Sumac, Kowloon Walled City, Trigger Object\n2024-12-11 6:00 PM\nGet Tickets\n12/11/25 - Distant\n2025-12-11 7:00 PM\nGet Tickets\n12/13/24 - Tyler Mac, Tris & The Goldmine Band\n2024-12-13 7:00 PM\nGet Tickets\n12/14/24 - Ruinscapes, ISYA, Precubed, Grave Chorus, AUMUA, Mourning Glories\n2024-12-14 7:00 PM\nGet Tickets\n12/15/24 - The Sapphic Stage\n2024-12-15 7:00 PM\nGet Tickets\n12/17/24 - \"A New Trip\" with SHANE MAUSS\nDescription: PENSACOLA!  Having just recorded his two-part comedy  special 'Trips'  at the immersive art mecca Meow Wolf, Shane Mauss  (pronounced Moss) is coming to The Handlebar to debut the third part of the  series.\n2024-12-17 7:00 PM\nGet Tickets\n12/20/24 - Goth Night\n2024-12-20 8:00 PM\nGet Tickets\n12/21/24 - Heavy Kid, Color the Void, East Hillbillies\n2024-12-21 7:00 PM\nGet Tickets\n12/22/24 - Marigold's Apprentice, Palmmeadow, Lights With Fire, Wild Charge\n2024-12-22 7:00 PM\nGet Tickets\n12/27/24 - Flow Tribe & More\n2024-12-27 7:00 PM\nGet Tickets\n12/28/24 - Glazed Eyes, Katie Dineen, Sick Room, Safety Training, Lazy Chair\n2024-12-28 6:00 PM\nGet Tickets\n12/29/24 - Hemlock, Accidant Prone, Pseudonyms, Riley Raine\n2024-12-29 6:00 PM\nGet Tickets\n12/31/24 - Cavae Mundi, Tuffalo and the Treewalkers\n2024-12-31 7:00 PM\nGet Tickets\n9/05/25 - Shelby Kemp & The Galbraith Sisters, About to Sweat\n2025-09-15 7:00 PM\nGet Tickets\n9/07/25 - White Phosphorus, Lesion, Hangnail Ripoff, Caca Del Diablo\n2025-09-07 7:00 PM\nGet Tickets\n9/18/2025 - Darkwaves: Tiki Soirée, Kuru Remstate, Basilantros\n2025-09-18 8:00 PM\nGet Tickets\n9/19/25 - Lights With Fire Album Release Show, Snow Halo, Mourning Glories\n2025-09-19 7:00 PM\nGet Tickets\nVenue Hours\nTuesday 4pm - 11pm\nWednesday 4pm - 2am\nThursday 4pm - 2am\nFriday 4pm - 2am\nSaturday 12pm - 2am\nSunday 12pm - 12am\n319 N Tarragona St\nPensacola, FL 32502\nAddress\n319 N Tarragona St\nPensacola, FL 32502\nGet Directions\nPowered By\nSpread\nthe word\nPENSACOLA’S LEGENDARY MUSIC VENUE IS BACK AND BOOKING FOR\nSUMMER\n2025\nVisit our Facebook\nVisit our Instagram\nEvents\nNotable Acts\nBooking\nBar Menu\nAbout\nBlog\nContact\nWebsite & Ticketing Powered by TicketSilver",
      "emails": [
        "booking@thehandlebar850.com",
        "michael@silver-industries.com"
      ]
    },
    {
      "url": "https://thehandlebar850.com/about/",
      "is_candidate": false,
      "has_email": true,
      "text": "about us\nSince 1983, The Handlebar has always been known as the home for Pensacola’s Music Scene.\nNow in its third rendition, The Handlebar continues to stand behind that message. Music is a unifier among people from numerous walks of life. Music helps us escape the moment and connect with both friends and strangers. The Handlebar has reopened its doors to make sure that Pensacola always has a place to experience underground & alternative music.\nOur venue is a focused blend of the old and new. Our historical brick walls and steel beams are paired with a brand new bar with substantial offerings, an upgraded sound and lighting system, an enhanced patio entranceway, and four revamped bathrooms to create a pleasing atmosphere where you can enjoy going to shows and hanging out to the fullest.\nThe Handlebar extends beyond its walls and into the community, connecting its music diehards with its bar regulars. We are the place for everyone, especially those who don’t (or don’t want to) fit the mold. The Handlebar gave us all memories years ago and we want to continue giving our community lasting memories for years to come.\nlearn more\n11.08.1983\nThe Start\nDeloris Pierce the owner of DEE'S family was a French Creole family out of New Orleans. Her father, Abe Pierce owned Abe's 506 and The Saber Club. Lee, Tom, and Jim would come and hang out,  and she offered to sell it to them... and that's how the Handlebar started.\n04.11.2001\nThe Fire\nIn the early morning hours of April 11, 2001, a fire gutted the HandleBar's historic brick building.\n12.21.2002\nRebuild\nA lot of help from a lot of great people! 20 months later we reopened with Lowell Husband and new Co-Owner. Previously partitioned into three separate rooms, the building now has no interior walls.\n11.01.2018\nClosed Down\nIn November 2018, the popular venue suddenly, and permanently closed... or so we thought!\n08.13.2022\nPresent Time\nNew owners, Kathy Sandstrom and Chris McKean, worked with manager Robert Goodspeed and reopened after almost 4 years closed, with a full remodel. The attendee entrance is now through the outdoor courtyard, on Belmont St. and boasts a full liquor license.\nVenue Hours\nTuesday 4pm - 11pm\nWednesday 4pm - 2am\nThursday 4pm - 2am\nFriday 4pm - 2am\nSaturday 12pm - 2am\nSunday 12pm - 12am\n319 N Tarragona St\nPensacola, FL 32502\nAddress\n319 N Tarragona St\nPensacola, FL 32502\nGet Directions\nPowered By\nSpread\nthe word\nPENSACOLA’S LEGENDARY MUSIC VENUE IS BACK AND BOOKING FOR\nSUMMER\n2025\nVisit our Facebook\nVisit our Instagram\nEvents\nNotable Acts\nBooking\nBar Menu\nAbout\nBlog\nContact\nWebsite & Ticketing Powered by TicketSilver",
      "emails": [
        "booking@thehandlebar850.com",
        "michael@silver-industries.com"
      ]
    }
  ],
  "all_links": [
    "https://thehandlebar850.com/hb-events/06-12-25-bodybox-decoy-fogcrawler-morraagora-command-voice/",
    "https://thehandlebar850.com/cart/",
    "https://thehandlebar850.com/hb-events/11-02-25-dangerous-summer-bad-luck/",
    "https://thehandlebar850.com/hb-events/02-08-25-brainburn-ep-release-delta-hate-paid-in-blood-eyezin-no-surrender/",
    "https://thehandlebar850.com/hb-events/03-30-25-pensacola-songwriter-rounds-series-n-a/",
    "https://thehandlebar850.com/hb-events/10-09-25-glixen/",
    "https://thehandlebar850.com/hb-events/08-05-25-20-watt-tombstone-husky-burnette/",
    "https://thehandlebar850.com/hb-events/11-06-25-galactic-empire/",
    "https://thehandlebar850.com/hb-events/07-27-25-bear-ghost-spaceman-bob/",
    "https://thehandlebar850.com/hb-events/07-18-25-no-truth-exit-life-trash-world-strikeforce-serrated-fl-hangnail-ripoff/",
    "https://thehandlebar850.com/hb-events/06-26-25-pensacola-songwriter-rounds-johnny-hayes-molly-thomas-noah-desimone-katie-dineen/",
    "https://thehandlebar850.com/hb-events/07-06-25-tuffalo-and-the-treewalkers-tremors-rise-up-lights/",
    "https://thehandlebar850.com/hb-events/08-07-25-harbour-harbour/",
    "https://thehandlebar850.com/hb-events/01-03-25-heavy-weather-about-to-sweat-funky-lampshades/",
    "https://thehandlebar850.com/hb-events/03-03-25-comedian-steve-hofstetter-with-special-guests/",
    "https://thehandlebar850.com/hb-events/06-07-25-broadway-rave-n-a/",
    "https://thehandlebar850.com/hb-events/07-21-25-profanatica-unidad-trauma-knoll/",
    "https://thehandlebar850.com/hb-events/08-08-25-the-bottoms-heavy-kid-starlin/",
    "https://thehandlebar850.com/hb-events/04-19-25-lunar-vacation/",
    "https://thehandlebar850.com/hb-events/10-02-25-petite-league-dead-star-city-tour/",
    "https://thehandlebar850.com/hb-events/02-06-25-maggie-miles-recess-party-sofia-camille/",
    "https://thehandlebar850.com/hb-events/08-16-25-house-of-androgyny/",
    "https://thehandlebar850.com/hb-events/08-14-25-attack-dog-tirra-lirra-lights-with-fire/",
    "https://thehandlebar850.com/hb-events/10-20-25-mexican-slum-rats/",
    "https://thehandlebar850.com/hb-events/11-22-24-cytotoxin-cognitive-inoculation-necroticgorebeast-rotted-remains-and-hemlock/",
    "https://thehandlebar850.com/hb-events/07-11-25-seth-david-n-a/",
    "https://thehandlebar850.com/hb-events/07-31-25-tyler-livingston-and-tyler-mac/",
    "https://thehandlebar850.com/hb-events/10-25-24-brave-new-world-oversight-safety-training/",
    "https://thehandlebar850.com/hb-events/02-13-25-zulu-lie-knife-wound-no-surrender/",
    "https://thehandlebar850.com/hb-events/02-05-25-two-piece-chain-gang-pure-bliss-statement-of-pride/",
    "https://thehandlebar850.com/hb-events/https-thehandlebar850-com-hb-events-02-23-25-agent-orange/",
    "https://thehandlebar850.com/hb-events/01-24-25-flying-raccoon-suit-runaway-ricochet/",
    "https://thehandlebar850.com/hb-events/08-10-25-grizz-vick-vapors-user-assumes-risk/",
    "https://thehandlebar850.com/hb-events/08-19-25-boundaries-stick-to-your-guns-gates-to-hell-psycho-frame/",
    "https://thehandlebar850.com/",
    "https://thehandlebar850.com/hb-events/06-27-25-ctrl-alt-drag-n-a/",
    "https://thehandlebar850.com/hb-events/07-20-25-caving-in-dead-etiquette-rise-up-lights-widow-anchor-ghostlings/",
    "https://thehandlebar850.com/hb-events/06-08-25-in-her-own-words-embl3m-glimmers-safety-training/",
    "https://thehandlebar850.com/contact/",
    "https://thehandlebar850.com/hb-events/04-18-25-widow-anchor-tremors-knives-with-fire-came-disparity/",
    "https://thehandlebar850.com/hb-events/06-30-25-suffocation-accursed-creator-modown-hemlock/",
    "https://thehandlebar850.com/hb-events/10-15-24-gulf-coast-drag-race/",
    "https://thehandlebar850.com/hb-events/12-05-24-hirs-collective-deceased/",
    "https://thehandlebar850.com/hb-events/02-14-25-vision-video-grave-chorus/",
    "https://thehandlebar850.com/hb-events/09-28-2025-zach-amino-zach-holmes/",
    "https://thehandlebar850.com/hb-events/06-22-25-orthodox-mugshot-omerta-and-from-joy/",
    "https://thehandlebar850.com/hb-events/01-27-26-comedian-gabriel-rutledge-dont-read-the-comments-tour/",
    "https://thehandlebar850.com/hb-events/10-22-24-gulf-coast-drag-race/",
    "https://thehandlebar850.com/hb-events/09-26-25-red-and-the-revelers-rufus-mcblack/",
    "https://thehandlebar850.com/hb-events/10-19-25-nik-flagstar-and-his-dirty-mangy-dogs-proper-punktuation-matthew-w-charles/",
    "https://thehandlebar850.com/hb-events/03-07-gimme-gimme-disco/",
    "https://thehandlebar850.com/hb-events/08-18-25-dayglo-abortions-future-hate/",
    "https://thehandlebar850.com/hb-events/03-28-25-urban-heat-ynicorns-tirra-lirra/",
    "https://thehandlebar850.com/hb-events/10-04-25-the-constellations-heavy-kid/",
    "https://thehandlebar850.com/events/",
    "https://thehandlebar850.com/hb-events/05-31-25-work-it-90s-2000s-rb-and-hip-hop-night-featuring-12eleven-n-a/",
    "https://thehandlebar850.com/hb-events/03-27-25-cavae-mundi-morning-trips-ballastella-hishiwi/",
    "https://thehandlebar850.com/hb-events/06-18-25-mike-v-and-the-rats-mike-v-and-the-rats/",
    "https://thehandlebar850.com/hb-events/10-05-25-comedian-shelly-belly/",
    "https://thehandlebar850.com/hb-events/08-11-25-yot-club/",
    "https://thehandlebar850.com/hb-events/10-13-25-archers-nerv-of-virtue-dead-eyes/",
    "https://thehandlebar850.com/hb-events/06-25-25-improvable-cause-presents-cheese-for-the-table/",
    "https://thehandlebar850.com/hb-events/02-28-25-mardi-grass-brass-the-new-cahoots-5-mile-brass/",
    "https://thehandlebar850.com/hb-events/10-23-24-improvable-cause-cheese-for-the-table/",
    "https://thehandlebar850.com/hb-events/11-19-24-left-lane-cruisers-20-watt-tombstone-dead-devils/",
    "https://thehandlebar850.com/hb-events/12-29-24-hemlock-accidant-prone-pseudonyms-riley-raine/",
    "https://thehandlebar850.com/hb-events/10-11-25-the-callous-daoboys-unitytx-your-spirit-dies-crush/",
    "https://thehandlebar850.com/hb-events/09-21-2025-insomniac-cursed-body/",
    "https://thehandlebar850.com/hb-events/05-29-25-umphreys-mcgee-afterparty-runaway-gin-phish-tribute/",
    "https://thehandlebar850.com/hb-events/8-23-25-felmax-big-n-slim-hydyne-smoothlettuce/",
    "https://thehandlebar850.com/hb-events/https-thehandlebar850-com-hb-events-10-17-24-eric-lindell/",
    "https://thehandlebar850.com/hb-events/12-21-24-heavy-kid-color-the-void-east-hillbillies/",
    "https://thehandlebar850.com/hb-events/11-03-24-matt-haus-memorial-benefit-fatejacket-bangarang-peter-paupers-grave-tremors-shelly-clutts-never-ending/",
    "https://thehandlebar850.com/hb-events/10-08-24-gulf-coast-drag-race/",
    "http://thehandlebar850.com/",
    "https://thehandlebar850.com/hb-events/03-04-25-smoking-popes-camp-trash-rodeo-boys/",
    "https://thehandlebar850.com/hb-events/06-20-25-saint-social-pennybomb-marigolds-apprentice-neon-tomboy-willow-and-the-misdemeanors/",
    "https://thehandlebar850.com/hb-events/10-21-24-mannequin-pussy-margaritas-podridas/",
    "https://thehandlebar850.com/hb-events/02-22-25-palomino-blond-high-lazy-chair/",
    "https://thehandlebar850.com/hb-events/04-10-25-dionysus-funk-heads-lightyear-sisters/",
    "https://thehandlebar850.com/hb-events/05-16-25-ritual-6-goth-industrial-night-n-a/",
    "https://thehandlebar850.com/hb-events/04-20-25-wormrot-no-mas-bandit-infernem/",
    "https://thehandlebar850.com/hb-events/10-29-24-pig-unitcode-machine/",
    "https://thehandlebar850.com/hb-events/04-13-25-atoll-demon-king-cesspool-corruption-rat-king-accursed-creator/",
    "https://thehandlebar850.com/hb-events/08-29-25-cutthroat-friends/",
    "https://thehandlebar850.com/hb-events/02-18-25-american-aquarium/",
    "https://thehandlebar850.com/hb-events/04-25-25-emo-night/",
    "http://thehandlebar850.com/venue/",
    "https://thehandlebar850.com/hb-events/03-26-25-improvable-cause-cheese-for-the-table/",
    "https://thehandlebar850.com/hb-events/04-26-25-hopout-glsnr-nvsn-oversight/",
    "https://thehandlebar850.com/hb-events/11-14-25-inoha-slow-joy-worry-club/",
    "https://thehandlebar850.com/hb-events/01-25-25-taylor-hollingsworth-mourning-glories/",
    "https://thehandlebar850.com/hb-events/04-22-25-clementine-lights-with-fire-kyker-other/",
    "https://thehandlebar850.com/hb-events/06-09-25-ghost-chant-fly-over-states-scream-out-loud-rise-up-lights/",
    "https://thehandlebar850.com/hb-events/12-11-24-sumac-kowloon-walled-city-trigger-object/",
    "https://thehandlebar850.com/hb-events/01-20-25-bonginator-frog-mallet-trash-panda-2/",
    "https://thehandlebar850.com/hb-events/04-12-25-jaimes-miller-benefit-show-n-a/",
    "https://thehandlebar850.com/hb-events/09-04-2025-pensacola-comedy-club-featuring-ryan-pfeiffer-lena-ibrahim-arun-krishnan-and-christian-williams/",
    "https://thehandlebar850.com/hb-events/12-17-24-a-new-trip-with-shane-mauss/",
    "https://thehandlebar850.com/hb-events/01-11-25-glsnr-scream-out-loud-with-fire-came-disparity-palafoxx-snow-halo-grave-chorus/",
    "https://thehandlebar850.com/hb-events/https-thehandlebar850-com-hb-events-03-08-25-salvo-members-of-pain/",
    "https://thehandlebar850.com/hb-events/06-04-25-haywire-no-guard-statement-of-pride-serrated-fl-command-voice/",
    "https://thehandlebar850.com/hb-events/07-30-25-improvable-cause-presents-cheese-for-the-table/",
    "https://thehandlebar850.com/hb-events/12-27-24-flow-tribe-jordan-chase/",
    "https://thehandlebar850.com/hb-events/12-20-24-goth-night/",
    "https://thehandlebar850.com/hb-events/12-28-24-glazed-eyes-katie-dineen-sick-room-safety-training-lazy-chair/",
    "https://thehandlebar850.com/hb-events/08-01-25-brat-the-taints-spiral-broke-florida-boys/",
    "https://thehandlebar850.com/hb-events/02-21-25-the-good-lookings-color-the-void-safety-training-funky-lampshades/",
    "https://thehandlebar850.com/hb-events/10-27-24-pentagram-string-band-marigolds-apprentice-tuffalo-and-the-treewalkers/",
    "https://thehandlebar850.com/hb-events/06-27-25-gaga-nights-lady-gaga-dance-party/",
    "https://thehandlebar850.com/hb-events/10-10-24-dee-dee-kohl-benefit-show-ben-loftin-mike-garcia-john-hart-kairo-glazed-eyes/",
    "https://thehandlebar850.com/hb-events/12-11-25-distant/",
    "https://thehandlebar850.com/hb-events/12-09-24-edhochuli-acorns-lobachevsky-rat-daughter/",
    "https://thehandlebar850.com/hb-events/02-09-25-herakleion-void-infernem-hemlock/",
    "https://thehandlebar850.com/blog/",
    "https://thehandlebar850.com/hb-events/03-15-25-ben-loftin-the-family-john-hart-project/",
    "https://thehandlebar850.com/hb-events/07-12-25-five-eight/",
    "https://thehandlebar850.com/hb-events/01-31-25-dead-register-insomniac/",
    "https://thehandlebar850.com/hb-events/05-04-25-the-toasters-matamoska/",
    "https://thehandlebar850.com/hb-events/09-22-25-filth-narcotic-wasteland-innerwounds-spidershed/",
    "https://thehandlebar850.com/hb-events/11-01-24-strive-anniversary-benefit-show/",
    "https://thehandlebar850.com/hb-events/01-19-25-ellis-bullard-the-victrolas-allie-bryan/",
    "https://thehandlebar850.com/hb-events/05-24-25-lucero/",
    "https://thehandlebar850.com/hb-events/06-24-25-lie-cable-paid-in-blood-command-voice/",
    "https://thehandlebar850.com/hb-events/08-09-25-the-supervillains-with-local-guests/",
    "https://thehandlebar850.com/hb-events/07-13-25-ouija-macc-another-summer-in-hell-sinizter/",
    "https://thehandlebar850.com/hb-events/https-thehandlebar850-com-hb-events-10-28-24-boss-daughter-outlook-bleak-white-phosphorus/",
    "https://thehandlebar850.com/hb-events/01-18-25-counterfeit-a-tribute-to-limp-bizkit-transient-exformation/",
    "https://thehandlebar850.com/hb-events/06-27-2025-mayhem-monster-party-lady-gaga-drag-preshow-by-terrah-card/",
    "https://thehandlebar850.com/hb-events/03-22-25-strive-fundraiser-benefit-show/",
    "https://thehandlebar850.com/hb-events/03-24-25-haunt-hitten/",
    "https://thehandlebar850.com/hb-events/10-30-24-exhorder-forsaken-profits-dead-devils/",
    "https://thehandlebar850.com/hb-events/07-29-25-ballyhoo-cydeways-beachfly/",
    "https://thehandlebar850.com/hb-events/09-17-25-dylan-cotrone/",
    "https://thehandlebar850.com/hb-events/02-07-25-jumping-the-gun-no-complications-lights-with-fire/",
    "https://thehandlebar850.com/hb-events/02-26-25-improvable-cause-cheese-for-the-table/",
    "https://thehandlebar850.com/hb-events/05-18-25-pensacola-songwriter-rounds-series-pat-muesel-hale-winsler-kat-deal-katie-dineen/",
    "https://thehandlebar850.com/hb-events/05-23-25-woorms-future-hate/",
    "https://thehandlebar850.com/hb-events/04-16-25-improvable-cause-cheese-for-the-table/",
    "https://thehandlebar850.com/hb-events/05-10-25-night-on-the-tracks-palmmeadow-mourning-glories-grave-chorus-lasento/",
    "https://thehandlebar850.com/hb-events/08-02-25-80s-video-night-w-dj-poseidon/",
    "https://thehandlebar850.com/hb-events/08-27-25-improvable-cause-presents-cheese-for-the-table/",
    "https://thehandlebar850.com/hb-events/10-08-25-panzerfaus-groza-exformation-infernem-accursed-creator/",
    "https://thehandlebar850.com/hb-events/05-14-25-save-ferris-keep-flying/",
    "https://thehandlebar850.com/hb-events/05-25-25-ctrl-alt-drag-n-a/",
    "https://thehandlebar850.com/hb-events/07-25-25-gimme-gimme-disco/",
    "https://thehandlebar850.com/hb-events/9-05-25-shelby-kemp-the-galbraith-sisters/",
    "https://thehandlebar850.com/hb-events/01-13-25-liliths-demise-oinkliteration-innerwounds-hemolocria/",
    "https://thehandlebar850.com/hb-events/07-10-25-snacks-tirra-lirra-other/",
    "https://thehandlebar850.com/hb-events/01-22-25-improvable-cause-cheese-for-the-table/",
    "https://thehandlebar850.com/bar-menu/",
    "https://thehandlebar850.com/hb-events/05-08-25-come-to-ruin-user-assumes-risk/",
    "https://thehandlebar850.com/hb-events/05-19-25-peeling-flesh-two-piece/",
    "https://thehandlebar850.com/hb-events/08-26-25-keep-leaving-time/",
    "https://thehandlebar850.com/hb-events/11-20-24-snooper/",
    "https://thehandlebar850.com/hb-events/05-11-25-he-is-legend-cancer-bats-strawberry-girls-the-requiem/",
    "https://thehandlebar850.com/hb-events/11-10-25-narrow-head-judiciary/",
    "https://thehandlebar850.com/hb-events/01-16-25-sheer-terror-future-hate-burning-strong-serrated-fl/",
    "https://thehandlebar850.com/hb-events/12-15-24-the-sapphic-stage/",
    "https://thehandlebar850.com/hb-events/08-31-25-crowbar-eyehategod-slowhole/",
    "https://thehandlebar850.com/hb-events/10-30-25-silverada/",
    "https://thehandlebar850.com/hb-events/06-21-25-we-the-kings/",
    "https://thehandlebar850.com/hb-events/11-16-24-spiral-innerwounds-dead-allies-aliens-exist-lu-kang/",
    "https://thehandlebar850.com/hb-events/07-18-25-cannibal-kids-pretoria-morning-trips-marigolds-apprentice/",
    "https://thehandlebar850.com/hb-events/08-28-25-pensacola-songwriter-round-series/",
    "https://thehandlebar850.com/hb-events/04-11-25-fried-green-friday-panhandle-pirates-cremro-smith-dusty-deluna-sco-mazzi-and-more/",
    "mailto:booking@thehandlebar850.com",
    "https://thehandlebar850.com/hb-events/06-29-25-infernem-white-phosphorous-hangnail-ripoff-face-of-relief/",
    "https://thehandlebar850.com/hb-events/04-05-25-xotix-brainrack-cam-the-sella-parkit-t1lt3d/",
    "https://thehandlebar850.com/hb-events/03-09-25-partygirl-mourning-glories-basically-nancy-rat-palace/",
    "https://thehandlebar850.com/hb-events/10-18-25-taylor-hunnicutt-snake-and-the-rabbit-the-victrolas/",
    "https://thehandlebar850.com/hb-events/05-02-25-high-life-supernova-goldmine-tuffalo-and-the-treewalkers-the-big-reveal/",
    "https://thehandlebar850.com/hb-events/12-13-24-tyler-mac-tris-the-goldmine-band/",
    "https://thehandlebar850.com/hb-events/07-05-25-bloodrave/",
    "https://thehandlebar850.com/hb-events/11-09-24-hizashicon-aftershow-mac-ro-azazus-pagu/",
    "https://thehandlebar850.com/hb-events/05-30-25-wim-tapley-and-the-cannons/",
    "https://thehandlebar850.com/hb-events/03-20-25-rugh-other/",
    "https://thehandlebar850.com/hb-events/05-03-25-bearly-dead-n-a/",
    "https://thehandlebar850.com/hb-events/04-07-25-age-of-apocalypse-despize-cross-of-disbelief-paid-in-blood-serrated/",
    "https://thehandlebar850.com/hb-events/11-15-24-jordan-chase-melodious-allen-the-funk-heads-ben-loftin/",
    "https://thehandlebar850.com/hb-events/11-09-25-nixil-saidan/",
    "https://thehandlebar850.com/hb-events/01-02-25-gnarled-red-beard-wall-blight-innerwounds-decaying-eucharist/",
    "https://thehandlebar850.com/hb-events/04-27-25-the-sapphic-stage-presents-cowboys-vs-aliens-n-a/",
    "https://thehandlebar850.com/hb-events/07-26-25-rufus-mcblack-whitmer-thomas-glsnr-snow-halo/",
    "https://thehandlebar850.com/hb-events/09-12-25-big-time-maca-sam-skolnik-olivia-searcy-ray-lau-aaron-monte/",
    "https://thehandlebar850.com/hb-events/11-29-24-12eleven-the-nova-lightyear-sisters/",
    "https://thehandlebar850.com/hb-events/03-11-25-reconciler-paupers-grave-lunch-break/",
    "https://thehandlebar850.com/hb-events/10-20-24-pensacola-songwriter-rounds-show-series-john-hart-justin-colvard-lundy-katie-dineen/",
    "https://thehandlebar850.com/hb-events/08-30-25-downtown-meltdown-ben-loftin-the-family-katie-dineen-and-more/",
    "https://thehandlebar850.com/hb-events/12-14-24-ruinscapes-isya-precubed-grave-chorus-aumua-mourning-glories/",
    "https://thehandlebar850.com/hb-events/08-03-25-ctrl-alt-drag/",
    "https://thehandlebar850.com/hb-events/02-27-25-pensacola-songwriter-rounds-series/",
    "https://thehandlebar850.com/hb-events/08-24-25-pensacola-slam-jam/",
    "https://thehandlebar850.com/hb-events/10-01-24-gulf-coast-drag-race/",
    "https://thehandlebar850.com/hb-events/12-22-24-marigolds-apprentice-palmmeadow-lights-with-fire-wild-charge/",
    "http://thehandlebar850.com/events",
    "https://thehandlebar850.com/hb-events/01-05-25-daikaiju/",
    "https://thehandlebar850.com/hb-events/08-15-25-flow-tribe/",
    "https://thehandlebar850.com/hb-events/12-06-24-gnarled-brethren-hogg-slugger/",
    "https://thehandlebar850.com/hb-events/9-07-25-white-phosphorus-lesion-hangnail-ripoff-caca-del-diablo/",
    "https://thehandlebar850.com/hb-events/06-10-25-recovery-benefit-show-marigolds-apprentice-wild-charge-paid-to-pretend-glazed-eyes-mourning-glories/",
    "https://thehandlebar850.com/hb-events/03-23-25-capstan-the-cult-tour-colorblind-not-enough-space-afterdusk/",
    "https://thehandlebar850.com/hb-events/05-28-25-improvable-cause-presents-cheese-for-the-table/",
    "https://thehandlebar850.com/hb-events/04-04-25-68-silly-goose-islander/",
    "https://thehandlebar850.com/hb-events/10-31-24-ritual-6-goth-industrial-dance-party/",
    "https://thehandlebar850.com/hb-events/11-14-24-fury-in-few-drook-palmmeadow-dead-etiquette-dead-allies/",
    "https://thehandlebar850.com/hb-events/06-16-25-tx2-dark-divine/",
    "https://thehandlebar850.com/hb-events/09-30-25-i-set-my-friends-on-fire-enthronement-hopout-with-fire-came-disparity/",
    "https://thehandlebar850.com/hb-events/11-30-24-bottomless-brunch-hosted-by-terrah-card/",
    "https://thehandlebar850.com/hb-events/05-20-25-attack-attack-convictions-downswing-and-uncured/",
    "https://thehandlebar850.com/hb-events/07-14-25-gunshine-n-a/",
    "https://thehandlebar850.com/hb-events/01-17-25-broadway-rave/",
    "https://thehandlebar850.com/hb-events/04-03-25-cloakroom/",
    "https://thehandlebar850.com/venue/",
    "https://thehandlebar850.com/hb-events/04-17-25-gulf-coast-kids-house-benefit-n-a/",
    "https://thehandlebar850.com/hb-events/06-14-2025-house-of-androgyny-drag-show/",
    "https://thehandlebar850.com/hb-events/09-24-25-the-hails-edgehill/",
    "https://thehandlebar850.com/hb-events/10-24-24-icons-of-horror-hanna-biotic-joan-of-dark-goblin-babe-bones-xena-morphine-braxton-hicks-miss-fortune-wanda-doomy/",
    "https://thehandlebar850.com/hb-events/06-28-25-emo-rave-presented-by-kulture-kreated-x-bassick/",
    "https://thehandlebar850.com/hb-events/01-23-25-the-band-feel-the-retrograde/",
    "https://thehandlebar850.com/hb-events/07-19-25-tanktok-spence-b-dj-dad-birdz-brody/",
    "https://thehandlebar850.com/hb-events/06-17-25-ginger-root/",
    "https://thehandlebar850.com/hb-events/09-06-25-mr-gnome-glsnr-palmmeadow/",
    "https://thehandlebar850.com/hb-events/09-20-25-broadway-rave/",
    "https://thehandlebar850.com/hb-events/05-15-25-alesana-scream-out-loud-brave-new-world/",
    "https://thehandlebar850.com/hb-events/12-10-24-emily-nenni-jarred-mcconnell-and-the-high-aces/",
    "https://thehandlebar850.com/hb-events/10-19-24-evalution-x-dennett-fifthdensity-tripsitter-wermzer/",
    "https://thehandlebar850.com/hb-events/11-12-24-rootbeer-richie-the-reveille-bankhead-boys-brickbats/",
    "https://thehandlebar850.com/hb-events/11-24-24-pensacola-songwriter-rounds-show-series-myke-v-austin-thompson-jacob-kirkland-katie-dineen/",
    "https://thehandlebar850.com/hb-events/12-31-24-cavae-mundi-tuffalo-and-the-treewalkers/",
    "https://thehandlebar850.com/hb-events/https-thehandlebar850-com-hb-events-11-10-24-showmethebody/",
    "https://thehandlebar850.com/hb-events/03-29-25-ritual-6-goth-industrial-night/",
    "https://thehandlebar850.com/hb-events/10-24-24-christworm-decaying-eucharist-hemlock/",
    "https://thehandlebar850.com/hb-events/03-14-25-pensacola-hardcore-showcase-burning-strong-statement-of-pride-spiral-no-surrender-more/",
    "https://thehandlebar850.com/hb-events/04-27-25-dear-cincinnati-almost-color-the-void-no-complications/",
    "https://thehandlebar850.com/hb-events/11-04-25-french-cassettes/",
    "https://thehandlebar850.com/hb-events/06-01-25-power-bomb-noise-next-door-marigolds-apprentice-mourning-glories/",
    "https://thehandlebar850.com/hb-events/10-13-24-cookies-and-cake-goodwin-rainer-julie-nolen-wiley-gaby/",
    "https://thehandlebar850.com/hb-events/09-13-25-grits-greens-nerf-the-world-funky-lampshades/",
    "https://thehandlebar850.com/hb-events/06-23-25-authority-zero-voodoo-glow-skulls-pinata-protest-red-and-the-revelers/",
    "https://thehandlebar850.com/hb-events/04-06-25-them-dirty-roses-n-a/",
    "https://thehandlebar850.com/hb-events/10-15-25-thou/",
    "https://thehandlebar850.com/hb-events/08-21-25-slow-degrade-day-aches-tuffalo-the-treewalkers-lucid/",
    "https://thehandlebar850.com/hb-events/10-10-25-work-it-90s-2000s-rb-and-hip-hop-night/",
    "https://thehandlebar850.com/hb-events/10-03-25-afterdusk-nick-nasty-dead-etiquette-caving-in/",
    "https://thehandlebar850.com/hb-events/10-17-25-bassick-events-x-sweettooth-dmz-tour/",
    "https://thehandlebar850.com/hb-events/11-07-24-anthony-raneri-the-everyday-royalty-tour/",
    "https://thehandlebar850.com/hb-events/11-30-24-red-and-the-revelers-grits-greens-bangarang-peter/",
    "https://thehandlebar850.com/hb-events/09-14-25-kimmi-bitter-snake-and-the-rabbit-katie-dineen/",
    "https://thehandlebar850.com/notable-acts-at-the-handlebar/",
    "https://thehandlebar850.com/hb-events/05-09-25-boots-n-beats-a-country-edm-concert/",
    "https://thehandlebar850.com/hb-events/05-17-25-sanguisugabogg/",
    "https://thehandlebar850.com/hb-events/06-06-25-glsnr-baby-in-the-90s-peace-pursuers-aumua-other/",
    "https://thehandlebar850.com/hb-events/12-07-24-party-iconic-presents-charli-parti/",
    "https://thehandlebar850.com/hb-events/07-24-25-pensacola-songwriter-rounds-series-katie-dineen-tori-lucia-gage-cowart-andrew-vinson/",
    "https://thehandlebar850.com/about/",
    "https://thehandlebar850.com/hb-events/10-26-24-glsnr-blind-tiger-hopout-cavae-mundi-spiral/",
    "https://thehandlebar850.com/hb-events/11-02-24-gimme-gimme-disco/",
    "https://thehandlebar850.com/hb-events/03-01-25-swallow-the-sun-harakiri-for-the-sky-ghost-bath-snakes-of-russia-blight/",
    "https://thehandlebar850.com/hb-events/11-05-24-gulf-coast-drag-race/",
    "https://thehandlebar850.com/hb-events/9-18-2025-darkwaves-tiki-soiree-kuru-remstate-basilantros/",
    "https://thehandlebar850.com/hb-events/01-26-25-pensacola-songwriter-rounds-series-mick-grocholl-runi-salem-nate-clay-katie-dineen-michael-magno/",
    "https://thehandlebar850.com/hb-events/01-09-25-six-feet-under/",
    "https://thehandlebar850.com/hb-events/03-16-25-milly-garage-sale-kairo-palmmeadow-garden-dweller/",
    "https://thehandlebar850.com/hb-events/06-13-25-casket-robbery-autumn-lies-buried/",
    "https://thehandlebar850.com/hb-events/10-18-24-terrifying-tribute-show-cockfight-cavae-mundi-roman-gabriel-todd-future-hate-glazed-eyes-acorns-the-spillers/",
    "https://thehandlebar850.com/hb-events/02-16-25-be-mine-burlesque/",
    "https://thehandlebar850.com/hb-events/11-01-25-jins/",
    "http://thehandlebar850.com/bar-menu",
    "https://thehandlebar850.com/hb-events/02-15-25-cane-hill-mugshot-fox-lake-weeping-wound/",
    "https://thehandlebar850.com/hb-events/05-22-25-beat-up-shidded-palmmeadow-lazy-chair/",
    "https://thehandlebar850.com/hb-events/07-23-25-kaleidoscope-crux-safety-training-aliens-do-exist/",
    "https://thehandlebar850.com/hb-events/08-22-25-ritual-6-goth-industrial-night/",
    "https://thehandlebar850.com/hb-events/10-12-24-vosh-shehehe-stgma-2/",
    "https://thehandlebar850.com/hb-events/9-19-25-lights-with-fire-album-release-show-snow-halo-mourning-glories/",
    "https://thehandlebar850.com/hb-events/03-21-25-glorious-flaws-outlook-bleak-wild-charge/"
  ],
  "candidate_links": [
    "https://thehandlebar850.com/contact/",
    "https://thehandlebar850.com/events/",
    "https://thehandlebar850.com/about/"
  ],
  "visited": [
    "http://thehandlebar850.com/",
    "http://thehandlebar850.com/about",
    "http://thehandlebar850.com/contact",
    "http://thehandlebar850.com/staff",
    "http://thehandlebar850.com/team",
    "http://thehandlebar850.com/board",
    "http://thehandlebar850.com/directory",
    "http://thehandlebar850.com/events",
    "http://thehandlebar850.com/sitemap.xml",
    "http://thehandlebar850.com/council",
    "http://thehandlebar850.com/leadership",
    "http://thehandlebar850.com/management",
    "http://thehandlebar850.com/producers",
    "http://thehandlebar850.com/support",
    "http://thehandlebar850.com/crew",
    "http://thehandlebar850.com/members",
    "http://thehandlebar850.com/bios",
    "http://thehandlebar850.com/people",
    "http://thehandlebar850.com/artists",
    "http://thehandlebar850.com/musicians",
    "http://thehandlebar850.com/faculty",
    "http://thehandlebar850.com/administration",
    "https://thehandlebar850.com/contact/",
    "https://thehandlebar850.com/events/",
    "https://thehandlebar850.com/about/"
  ],
  "base_url": "http://thehandlebar850.com/"
}